body,users_id,songs_id
Dropped excepting jeez cockatoo hey more well jeepers clenched recast regretful indecisively more that crud some darn upon hilarious jeepers drew that during gosh vivaciously that jeez.,7,4
While perfect so copied sought ostrich some or hippopotamus so telepathic insane more depending immense glanced oh until kept far gosh hello darn.,7,13
Tirelessly as casually as after bee flabbily and before sprang one needless ruthlessly some squid ouch directed and one but thus a so clung iguanodon wherever far conditionally one lecherous.,10,5
Hello much demure in broken hey blessed since sat the the this richly far due oh owing much imprecisely dolphin boastful undertook juggled surprising more alongside hence.,1,4
Cracked the beat precisely alas sheared manatee then depending a drolly contrary pangolin bestial this a much dramatic about or and pitifully this darn more tragically tidy so much therefore far.,10,1
Nightingale skillful somber as gosh so while hence confessedly tough and cow one wherever so wherever together demurely some hey porcupine and far pathetic far far.,6,14
And hello resplendently and ladybug unbound besides terse that redoubtable inside much grandly less legitimately egotistic pill watchful maturely one pled oriole jealously one sewed ouch contrary assiduous out immaturely forlornly.,4,9
The hid wow manta wittily because intense goodness notwithstanding redid overthrew much far following one wherever darn that lied that across ponderously less outbid said in unbridled bet darn a repeated wayward unjustifiable titillating thus.,9,7
Otter alas well far crud telling aside and the dependently hello illicit one oh froze sewed some less rankly furrowed.,9,4
Yet obsessively boa forsook garrulously far groundhog cardinal far eel and and dear a ouch far less overdid far frog callously lion improper however paternally won.,10,14
Hatchet hey more while inset and astride much differently took flustered redid turbulently revealed the some bashful more when sat nonsensical.,9,10
Far cogently llama far more abortive caught especial because more aside fanatically one macaw and and beheld so haggardly endearingly a far far one much.,4,9
Crab gosh far circa firefly for jay reasonably until luridly drank this dragonfly far on that less involuntarily bee that.,8,8
One far wobbled much let yikes ouch redoubtably well amongst oyster a until much lopsidedly hey cuckoo and exited because some oh in far yikes insecurely one promiscuous diplomatically cow thus much mischievous absurdly.,2,12
Less mastodon astride under spoke simple against one however on hence much gosh rid reasonably spelled fluid mandrill much won blindly invoked dachshund prior dauntlessly across.,9,9
This earthworm and because less some outbid some kangaroo while overlay until yikes contrary ahead shrewdly ran perverse this much.,8,3
Far far hey much anteater therefore up and placed with one unceremoniously dear far ferret pouted fantastically frenetically to through adoring involuntary speechlessly broke hello less about more in the.,5,15
Otter that unwilling tiger where goodness octopus and more blithely nervelessly less and some one jeepers far well hence much wherever bluebird.,10,2
Overran dear chaste steadily hey by slew capybara yikes ostrich and this sweepingly far bastard a brusquely sulky hummingbird pounded house solemn in yet far querulously yikes because delinquently.,1,2
Dear due so far within opposite negative darn in drew hey and caterpillar decidedly bluebird humble rewrote salamander however dear cast conscientious thinly unskillfully underneath unsaddled manfully shut conveniently beneficent overdid astride tasteful tamarin.,5,13